{
  "task_id": "personal-website",
  "status": "completed",
  "paused": false,
  "pause_reason": null,
  "current_blocker": null,
  "lease": null,
  "retry_policy": {
    "total_attempts": 14,
    "consecutive_failures": 0,
    "last_error": null,
    "last_failure_at": null
  },
  "pending_human_actions": [],
  "last_event_id": 77,
  "last_event_at": "2026-03-24T14:59:59.109Z",
  "updated_at": "2026-03-24T14:59:59.109Z"
}
